"67",1884,"MKWS","jtez1bcngrnzum1c","02/11/2020 19:52","qualified,20200131_10:51_v5",3,0,0,0,0,0,1,0,0,0,0,0,NA,0,0,0,0,0,1,0,0,0,0,0,NA,0,1,1,1,0,0,0,"Astoria",97103,"25+","Cathlamet Washington",98612,"15-25",1,1,0,0,NA,"1-3","U25",0,0,0,0,0,1,1,0,NA,"no",NA,"50+","50-60","male",NA,"no","no","NA","no_change","no_change","decrease",NA,NA,"no_obs_change",NA,"idk","med","no_effect","high","no_effect","med","idk","med","slight_pos","med","idk","med","idk","low","idk","low","idk","low","idk","low","NA","NA","yes","Sea lion and seal predators. Commrant predation on smolt out migrations","yes","Decline in hatchery stocks do to less smolt production","no",NA,"Warm water species","Salmon","somewhat","somewhat","none","none","none","very","somewhat","very","occasionally","occasionally","never","never","never","occasionally","occasionally","occasionally","very","somewhat","somewhat","somewhat","somewhat","none","somewhat","frequently","occasionally","occasionally","occasionally","occasionally","occasionally","occasionally","somewhat","very","very","very","occasionally","frequently","frequently","frequently","somewhat","none","none","none","occasionally","never","never","never","neutral","neutral","neutral","somewhat_disagree","somewhat_disagree","neutral","neutral","strongly_agree","somewhat_agree","strongly_disagree","neutral","strongly_agree","neutral","neutral","neutral","strongly_agree","neutral","neutral","somewhat_agree","somewhat_disagree","somewhat_disagree","somewhat_disagree","somewhat_disagree","somewhat_disagree","neutral","neutral","somewhat_agree","strongly_agree","strongly_agree","strongly_agree","strongly_agree","strongly_agree","strongly_agree","strongly_disagree","neutral","somewhat_agree","neutral","somewhat_disagree","somewhat_disagree","strongly_agree","somewhat_agree","somewhat_agree","strongly_agree","strongly_agree","somewhat_agree","somewhat_agree","neutral","somewhat_disagree","neutral","neutral","I believe climate change is always happening cycles of warm and cold  have been this way forever","Raise more hatchery fish and stream enhancements","Olaf  Thomason","olafthomason@icloud.com",1,2187.126,12,NA,11,NA,1,1,"02/11/2020 19:15",NA,NA,NA,0,"Mozilla/5.0 (iPhone; CPU iPhone OS 13_3 like Mac OS X) AppleWebKit/605.1.15 (KHTML, like Gecko) Version/13.0.4 Mobile/15E148 Safari/604.1","si","/survey/selfserve/5d8/191103?sampid=102113&pin=MKWS&mail=1","xncpj28ndtv83bgr",1,102113
"68",1915,"BJQR","sw327nj2ubb0jfr2","02/13/2020 10:25","qualified,20200131_10:51_v5",3,0,1,1,0,1,1,0,0,0,0,1,"halibut",0,1,0,0,1,1,0,0,0,0,0,NA,0,1,0,1,0,0,0,"Chinook",98614,"25+","sammamish, warrenton",98074,"25+",1,1,0,0,NA,"4-7","46-55",1,0,0,1,0,0,1,0,NA,"no",NA,"U10","60-70","no_response",NA,"no","no","prefer not to answer","no_change","no_change","decrease",NA,NA,"no_obs_change",NA,"no_effect","high","no_effect","high","no_effect","high","no_effect","high","no_effect","high","no_effect","high","idk","high","idk","high","idk","high","idk","high","no_effect","high","no",NA,"no",NA,"no",NA,"DONT BELEIVE IN CLIMATE CHANGE","NO","none","none","none","none","none","none","none","none","never","never","never","never","never","never","never","never","very","very","very","very","very","none","very","occasionally","frequently","frequently","frequently","frequently","frequently","frequently","somewhat","very","none","very","occasionally","occasionally","never","frequently","somewhat","none","somewhat","none","occasionally","never","occasionally","never","strongly_disagree","strongly_disagree","strongly_disagree","strongly_disagree","somewhat_disagree","strongly_agree","strongly_disagree","strongly_agree","somewhat_disagree","neutral","strongly_agree","strongly_disagree","somewhat_disagree","somewhat_disagree","strongly_agree","I have not observed any changes","I have not observed any changes","I have not observed any changes","I have not observed any changes","I have not observed any changes","I have not observed any changes","I have not observed any changes","I have not observed any changes","I have not observed any changes","strongly_agree","strongly_agree","somewhat_agree","strongly_agree","strongly_agree","somewhat_agree","neutral","somewhat_disagree","strongly_agree","somewhat_disagree","somewhat_agree","somewhat_agree","somewhat_agree","strongly_disagree","strongly_disagree","somewhat_agree","strongly_agree","strongly_disagree","neutral","strongly_disagree","strongly_agree","somewhat_disagree","somewhat_disagree","neutral","neutral","strongly_agree","MAKE INDIANS AND NON-INDIANS EQUAL IN ALL FISHERIES,,  I WAS BORN IN THIS COUNTRY, MAKES ME A NATIVE AMERICAN  MY FOREFATHERS DID NOT SIGN TREATIES WITH INDIANS  TIRED OF  TREATY RIGHTS   TIRED OF ALL THE MILLENIALS WRINGING THEIR HANDS OVER INDIANS   TIRED OF WASHINGTON DEPARTMENT OF FISHERIES AND THEIR CROOKED ENFORCEMENT OFFICERS  TIRED OF BEING LINITED TO 45 MILES OF WASHINGTON COAST LINE, JUST BECAUSE IM NOT AN INDIAN.    MAN MADE GLOBAL WARMING IS A COMMUNIST PLOT MEANT TO REDISTRIBUTE MONEY.  JUST THE THOUGHT THAT ICE MELTING WILL RAISE OCEAN LEVELS IS COMPLETELY BS.  SORRY, TOO OLD TO BELIEVE IN THIS PLOT!!!","WISH I HAD THOUGHT OF GLOBAL WARMING  I WOULDN'T BE A FISHERMAN",NA,NA,1,1514.885,4,NA,3,NA,5,6,"02/13/2020 10:00",NA,NA,NA,0,"Mozilla/5.0 (Windows NT 10.0; WOW64; Trident/7.0; rv:11.0) like Gecko","..","/survey/selfserve/5d8/191103?sampid=101178&pin=BJQR&mail=1","3jsgg87fu4m4dbfa",1,101178
"69",1916,"EPCO","xxqdabched60fn75","02/13/2020 13:27","qualified,20200131_10:51_v5",3,0,0,0,0,0,1,0,0,0,0,1,"smelt, white sturgeon",0,0,0,0,0,1,0,0,0,0,1,"smelt",1,0,1,0,0,0,0,"Longview",98632,"25+","Rochester",98579,"25+",1,1,0,0,NA,"1-3","26-35",0,0,0,0,0,1,0,1,"dip net","yes","cooks inlet, AK.","none","70+","male",NA,"no","no","prefer not to answer","no_change","no_change","decrease","increase","sea lions & harbor seal","no",NA,"idk","high","idk","high","idk","high","idk","high","idk","high","slight_neg","high","idk","high","idk","high","idk","high","idk","high","slight_pos","high","yes","Over population of Calif. Sea Lions & Harbor Seals are destroying our salmon, Smelt runs along with the W. Sturgeon the Pacific west coast from Calif.to Alaska         We need to thin the herd. They are doing more harm than know!!!!!!! they are also doing great harm to the coastal bottom fish. They have migrated up the Columbia River above Bonneville Dam. They don't belong up our coastal rivers eating what ever they can catch including our W. Sturgeon spawning population at Bonneville Dam!!!!!!! WHEN ARE YOU GOING TO WAKE UP AND DO SOMETHING TO FIX THE PROBLEM ???????","yes","30 years ago I fished on the Columbia River 5 to 14 days in the winter for Chinook Salmon, 14 to 20 day for Spring Chinook, 15 to 20 days for summer Chinook, 14 + days in August for Coho, Chinook and W.Sturgeon then our fall season began around September 10th-12th and ran thru November 15th five days a week starting at 6 pm Sunday to Friday at 6 pm 24 hours a day.    I also fished for sockeye salmon in Puget Sound in July and August. October, November was time for chum salmon fishing.    I also fished Willapa Bay & Grays Harbor for W. Sturgeon and all salmon species available    The last 5 years I fished 3 or 4 nine hour periods for spring Chinook, 4 to 9 nine hour periods in August for fall Chinook, 3 to 9 day of restricted coho fishing.    No sockeye and aprox. 10 day of chum fishing in Puget Sound    QUITE A CHANGE DON'T YOU THINK!!!! all in the name of conservation. YOU GET A FAILING GRADE!!","yes","Sport Fishing been given a larger percentage of available fish, hatcheries have been shut down by the Feds to protect alleged Wild Salmon, Sea lions run wild so runs we used to fish aren't available. I gave you a run down on the last question.","none, you can't stop climate changing. If I were to ask you to lower the temp.half a degree how would you do it???    The Earth's climate had been changing since time began. Nothing or nobody can change it.","No","somewhat","somewhat","none","none","none","somewhat","somewhat","somewhat","occasionally","occasionally","never","never","never","occasionally","occasionally","occasionally","very","very","very","very","very","very","very","frequently","occasionally","frequently","frequently","frequently","frequently","frequently","very","very","somewhat","very","occasionally","occasionally","occasionally","occasionally","somewhat","none","none","none","occasionally","never","never","never","neutral","neutral","neutral","neutral","strongly_agree","strongly_agree","somewhat_agree","strongly_agree","somewhat_agree","neutral","strongly_agree","strongly_disagree","neutral","somewhat_agree","neutral","strongly_disagree","neutral","strongly_disagree","neutral","neutral","neutral","neutral","neutral","neutral","somewhat_agree","strongly_agree","strongly_agree","strongly_agree","somewhat_agree","somewhat_agree","neutral","somewhat_agree","strongly_disagree","strongly_disagree","strongly_disagree","strongly_disagree","somewhat_agree","strongly_disagree","strongly_disagree","strongly_disagree","somewhat_agree","strongly_disagree","strongly_disagree","strongly_disagree","somewhat_disagree","neutral","somewhat_disagree","neutral","neutral","somewhat_agree","Give up the wild stock and weakest stock management, plan and reopen closed hatcheries, update, build more hatcheries on weak stock rivers. Get rid of the fish farming that are harming our native stocks!!","no","Bruce Crookshanks","blackbart4@comcast.net",1,6888.149,4,NA,10,NA,5,6,"02/13/2020 11:32",NA,NA,NA,0,"Mozilla/5.0 (Windows NT 10.0; Win64; x64) AppleWebKit/537.36 (KHTML, like Gecko) Chrome/80.0.3987.100 Safari/537.36","..","/survey/selfserve/5d8/191103?sampid=111840&pin=EPCO&mail=1","wftahuezh65czdrh",1,111840
"70",1948,"FCYF","49kxb904jkgv2yhq","02/16/2020 13:38","qualified,20200131_10:51_v5",3,0,0,0,0,0,1,0,0,0,0,0,NA,0,0,1,0,0,0,0,0,0,0,0,NA,0,1,0,0,0,0,0,"Westport, Neah Bay",98595,"25+","Seattle",98166,"25+",1,1,0,0,NA,"1-3","U25",0,0,0,0,0,0,1,0,NA,"no",NA,"50+","70+","male",NA,"no","no","3-4","increase","increase","decrease",NA,NA,"yes_pos","The blob was the latest dissaster","strong_neg","med","slight_neg","med","slight_neg","med","idk","med","idk","med","strong_neg","med","idk","med","strong_pos","med","idk","med","slight_neg","med","NA","NA","yes","When the Bait goes so do the salmon","yes","The fishery has declined","yes","Had to move south or travel 50 miles to the fishing gronds","All of them","Not really","very","somewhat","very","somewhat","somewhat","somewhat","very","very","frequently","occasionally","frequently","occasionally","occasionally","frequently","frequently","occasionally","very","very","somewhat","somewhat","very","very","somewhat","occasionally","occasionally","frequently","frequently","occasionally","frequently","occasionally","somewhat","somewhat","somewhat","somewhat","occasionally","never","never","occasionally","somewhat","somewhat","very","somewhat","occasionally","never","frequently","occasionally","strongly_agree","somewhat_agree","somewhat_agree","strongly_agree","strongly_agree","somewhat_disagree","strongly_agree","somewhat_agree","somewhat_disagree","somewhat_agree","strongly_agree","strongly_agree","somewhat_disagree","somewhat_agree","somewhat_agree","somewhat_agree","neutral","somewhat_agree","somewhat_agree","somewhat_agree","somewhat_agree","neutral","somewhat_agree","somewhat_agree","strongly_disagree","neutral","somewhat_disagree","neutral","somewhat_agree","neutral","somewhat_disagree","strongly_disagree","somewhat_agree","somewhat_disagree","somewhat_disagree","somewhat_disagree","neutral","somewhat_agree","strongly_disagree","strongly_disagree","somewhat_disagree","strongly_disagree","neutral","somewhat_disagree","somewhat_agree","somewhat_disagree","somewhat_disagree","somewhat_agree","somewhat_disagree","somewhat_agree","Maybe if they treated fishermans like farmers instead of just letting them continue to fish and fail they would help them as they go","I'm glad I'm done all's I do now is lease my lic and that's been real iffy",NA,NA,1,3478.312,14,NA,10,NA,3,2,"02/16/2020 12:39",NA,NA,NA,0,"Mozilla/5.0 (Linux; Android 4.0.3; KFTT) AppleWebKit/537.36 (KHTML, like Gecko) Silk/73.7.5 like Chrome/73.0.3683.90 Safari/537.36","ta","/survey/selfserve/5d8/191103?sampid=107550&pin=FCYF&mail=1","yrvjr71745tfgztz",1,107550
"71",1981,"GMON","kkz5kyu7jckc3qbn","02/23/2020 19:54","qualified,20200131_10:51_v5",3,0,0,0,0,0,1,0,0,0,0,0,NA,0,0,0,0,0,1,0,0,0,0,0,NA,0,1,0,0,0,0,0,"Bellingham",98225,"25+","sedro woolley",98284,"25+",1,1,0,0,NA,"1-3","36-45",0,0,0,0,0,0,1,0,NA,"yes","troll s.e. alaska","50+","70+","male",NA,"no","no","1-2","increase","no_change","decrease",NA,NA,"yes_neg","finding that above average sea water temps. seem to be changing migratory patterns","idk","low","idk","low","idk","low","idk","low","slight_pos","med","slight_neg","med","idk","low","idk","low","idk","low","idk","low","NA","NA","yes","higher predatory interception by marine mammals","no",NA,"no",NA,"salmon","tuna","very","very","somewhat","somewhat","somewhat","somewhat","somewhat","somewhat","frequently","occasionally","occasionally","occasionally","occasionally","occasionally","occasionally","occasionally","very","very","very","very","very","very","very","frequently","frequently","frequently","frequently","frequently","frequently","frequently","somewhat","somewhat","none","somewhat","occasionally","occasionally","never","occasionally","very","somewhat","very","very","frequently","occasionally","frequently","frequently","neutral","neutral","neutral","somewhat_disagree","somewhat_agree","somewhat_agree","neutral","strongly_agree","somewhat_agree","strongly_disagree","strongly_agree","strongly_disagree","neutral","strongly_agree","somewhat_agree","neutral","neutral","neutral","neutral","neutral","neutral","neutral","neutral","neutral","somewhat_disagree","somewhat_disagree","neutral","neutral","somewhat_agree","somewhat_agree","neutral","somewhat_disagree","neutral","somewhat_agree","neutral","neutral","neutral","somewhat_disagree","somewhat_agree","neutral","neutral","somewhat_disagree","neutral","neutral","somewhat_disagree","somewhat_disagree","neutral","neutral","somewhat_disagree","neutral","more in season management","not at this time",NA,NA,1,24799.229,4,NA,10,NA,5,6,"02/23/2020 13:01",NA,NA,NA,0,"Mozilla/5.0 (Windows NT 10.0; Win64; x64) AppleWebKit/537.36 (KHTML, like Gecko) Chrome/79.0.3945.130 Safari/537.36","..","/survey/selfserve/5d8/191103?sampid=113136&pin=GMON&mail=1","t2dqcrx9kp35nu9j",1,113136
"72",2014,"FWXF","mc3hamjzm52z00dv","02/24/2020 09:11","qualified,20200131_10:51_v5",3,0,0,0,0,1,0,0,0,0,0,0,NA,0,0,0,0,1,0,0,0,0,0,0,NA,1,1,1,1,0,0,0,"Seattle",98119,"25+","King salmon",99613,"25+",1,0,0,0,NA,"1-3","46-55",0,0,0,0,0,0,1,0,NA,"yes","Salmon Alaska herring","none","60-70","male",NA,"no","no","NA","increase","increase","decrease","increase","Drizzle cold-warm front fine mist/fog ahead of storm long last foggy","yes_neg","Misty/drizzle fog makes collisions probable due to visibility loss. Sloppy weather makes condiitions more dangerous. Blob hot water spreads out smaller fish,desperate for bait fish. Anchovies have most fat and are what albacore need.","strong_neg","high","strong_neg","high","slight_neg","low","idk","low","strong_neg","high","strong_neg","high","strong_neg","high","strong_neg","high","strong_neg","high","idk","low","NA","NA","yes","The filter feeders rely on phytoplankton which need calcium and co2 absorb by water attacks calcium. Rain patterns change river nutrients when where and quantity making feast famine problem.","yes","Sockeye swarms from Alaska have shown off California not returning to Alaska","yes","Later usually.","Don't know","Don't know,non calcium is advantage w/co2 acidic absorb by ocean","very","very","very","very","very","very","very","very","frequently","frequently","frequently","frequently","frequently","frequently","frequently","frequently","very","very","very","somewhat","somewhat","none","somewhat","frequently","frequently","frequently","occasionally","frequently","occasionally","frequently","somewhat","somewhat","very","very","occasionally","frequently","frequently","frequently","very","none","very","none","frequently","never","frequently","never","strongly_agree","strongly_agree","strongly_agree","neutral","neutral","strongly_disagree","neutral","somewhat_agree","strongly_agree","neutral","strongly_agree","strongly_agree","somewhat_agree","strongly_agree","strongly_agree","neutral","somewhat_disagree","somewhat_disagree","neutral","neutral","neutral","somewhat_disagree","somewhat_agree","strongly_agree","strongly_disagree","strongly_agree","strongly_agree","strongly_agree","strongly_agree","strongly_agree","neutral","strongly_disagree","somewhat_agree","somewhat_agree","neutral","somewhat_disagree","neutral","strongly_agree","somewhat_agree","somewhat_agree","somewhat_agree","neutral","strongly_disagree","strongly_disagree","strongly_disagree","strongly_disagree","neutral","neutral","neutral","neutral","Need time to mull that.","Tsumai evac plan",NA,NA,1,2775.276,14,NA,10,NA,1,2,"02/24/2020 08:24",NA,NA,NA,0,"Mozilla/5.0 (Linux; Android 9) AppleWebKit/537.36 (KHTML, like Gecko) Version/4.0 Chrome/75.0.3770.143 Mobile Safari/537.36 DuckDuckGo/5","sa","/survey/selfserve/5d8/191103?sampid=108244&pin=FWXF&mail=1","3zrmye6qpnw66w05",1,108244
"73",2080,"2020","d52czm702usdfc7j","02/29/2020 11:00","qualified,20200131_10:51_v5",3,0,1,1,0,1,1,0,0,0,0,0,NA,0,1,1,0,1,1,0,0,0,0,0,NA,0,1,0,0,0,0,0,"Westport",98595,"25+","Westport",98595,"25+",1,1,0,0,NA,"1-3","56-65",0,0,0,1,0,0,1,1,"Charter Rods and reels","no",NA,"none","50-60","male",NA,"no","no","NA","no_change","no_change","decrease",NA,NA,"no_obs_change",NA,"no_effect","high","no_effect","high","no_effect","high","no_effect","high","no_effect","high","no_effect","high","no_effect","high","no_effect","high","no_effect","high","no_effect","high","NA","NA","yes","Sea lion populations are out of control salmon are being affected negatively","no",NA,"yes","regulations give us specfic times we can fish not when fish are in the area. for crab we have to wait until nearly february to start because the Tribes get to crab for nearly 2 months before we are allowed to participate . not many crab left to be harvested by the time we get to go.","none","none","none","none","none","none","none","none","none","none","never","never","never","never","never","never","never","never","somewhat","somewhat","somewhat","somewhat","somewhat","none","very","frequently","occasionally","frequently","occasionally","occasionally","never","frequently","very","very","very","very","frequently","occasionally","occasionally","occasionally","somewhat","somewhat","very","very","occasionally","occasionally","frequently","occasionally","neutral","neutral","neutral","strongly_disagree","somewhat_agree","neutral","strongly_disagree","strongly_disagree","strongly_agree","neutral","strongly_agree","somewhat_agree","strongly_disagree","strongly_disagree","somewhat_disagree","somewhat_agree","neutral","neutral","somewhat_agree","neutral","neutral","neutral","neutral","neutral","neutral","somewhat_agree","somewhat_agree","somewhat_agree","somewhat_agree","somewhat_agree","somewhat_agree","somewhat_agree","somewhat_agree","somewhat_disagree","somewhat_agree","somewhat_agree","somewhat_disagree","strongly_disagree","strongly_disagree","somewhat_agree","somewhat_agree","somewhat_disagree","somewhat_disagree","somewhat_disagree","neutral","neutral","neutral","somewhat_disagree","neutral","strongly_agree","Increase hatchery production asap, reduce sea lion populations asap, begin fishing in common with the tribes in all fisheries","Co management with the tribes is a failure . We need a system that supports non indian fisherman better. most of the tribal fisheries never existed 30 years ago. courts have taken from non tribal and given to tribal in an unfair manner","Geoffory Bryan Grillo","fishbiz1@comcast.net",1,2122.291,4,NA,2,NA,5,6,"02/29/2020 10:24",NA,NA,NA,0,"Mozilla/5.0 (Windows NT 10.0; Win64; x64) AppleWebKit/537.36 (KHTML, like Gecko) Chrome/70.0.3538.102 Safari/537.36 Edge/18.18363","..","/survey/selfserve/5d8/191103?sampid=999999&pin=2020&mail=2","gvjxrmttk273jr12",2,999999
"74",2147,"2020","wnbm63wcka5rc5qm","02/29/2020 20:30","qualified,20200131_10:51_v5",3,0,0,0,0,1,0,0,0,0,0,0,NA,0,0,0,0,1,0,0,0,0,0,0,NA,0,1,1,1,0,0,0,"Port Townsend",98368,"25+","Port Townsend",98368,"25+",1,1,0,0,NA,"1-3","66+",0,0,0,0,0,0,1,0,NA,"no",NA,"none","60-70","male",NA,"no","no","1-2","increase","no_change","decrease",NA,NA,"no",NA,"no_effect","low","no_effect","med","idk","high","idk","high","no_effect","med","idk","high","idk","high","idk","high","no_effect","med","idk","high","NA","NA","yes","feed abundance must have an effect. but so little is known about Albacore life cycle, migration,etc. who knows?","yes","30 years ago was the beginning of the offshore fishery for albacore (42NX150W) by 1998 or so the offshore fishery pretty much ended because of poor catches and the fleet mostly stayed on the coast","no",NA,"I can't say I've observed any changes in my environment that I can ascribe to climate change, maybe sea surface temps but that has been variable over the years. Warming is occurring as is evident in the Arctic, but fisheries and fish stocks have always been cyclical and affected by habitat degradation, sometimes over fishing. The popular press is eager to blame ever storm or period of drought or whatever on climate change I'm not familiar enough with the real science to know what is climate change and what is just the constantly changing environment I've always observed","who knows?","none","somewhat","none","none","none","none","none","somewhat","occasionally","occasionally","never","occasionally","never","never","never","occasionally","somewhat","very","none","very","very","none","very","occasionally","never","frequently","occasionally","occasionally","never","occasionally","none","none","none","somewhat","never","occasionally","never","occasionally","somewhat","none","none","none","occasionally","never","occasionally","never","somewhat_agree","somewhat_disagree","somewhat_agree","strongly_agree","somewhat_disagree","somewhat_agree","somewhat_disagree","somewhat_agree","neutral","somewhat_agree","somewhat_disagree","somewhat_disagree","neutral","neutral","somewhat_agree","somewhat_disagree","somewhat_disagree","somewhat_disagree","somewhat_disagree","somewhat_disagree","somewhat_disagree","somewhat_disagree","somewhat_disagree","somewhat_disagree","somewhat_agree","somewhat_agree","somewhat_agree","somewhat_disagree","somewhat_agree","somewhat_agree","strongly_agree","somewhat_agree","somewhat_agree","strongly_agree","somewhat_agree","somewhat_agree","somewhat_disagree","somewhat_disagree","somewhat_agree","somewhat_agree","somewhat_agree","somewhat_agree","somewhat_disagree","somewhat_agree","strongly_agree","somewhat_agree","strongly_agree","somewhat_disagree","somewhat_agree","neutral","Council membership could have more commercial fishing representation.","the political climate in Washington state is poor for commercial fishermen, most guys fish Alaska in this area, but between sport fishing priority and public perception has made Washington a hard place to fish commercially,","Bruce Samuelson","bruce_sam@q.com",1,7087.862,4,NA,12,NA,5,6,"02/29/2020 18:31",NA,NA,NA,0,"Mozilla/5.0 (Windows NT 10.0; Win64; x64; rv:73.0) Gecko/20100101 Firefox/73.0","..","/survey/selfserve/5d8/191103?sampid=999999&pin=2020&mail=2","14vqrfy5b4cxmsaa",2,999999
