"32",628,"FOGW","gs32gtc8gkgfjgum","01/07/2020 14:36","qualified",3,0,0,0,0,0,1,0,0,0,0,0,NA,0,0,0,0,0,1,0,0,0,0,0,NA,0,0,1,0,0,0,0,"Skamokawa",98647,"25+","Skamokawa",98647,"25+",1,1,0,0,NA,"1-3","26-35",0,0,0,0,0,1,0,0,NA,"no",NA,"50+","70+","male",NA,"no","no","1-2","increase","increase","decrease",NA,NA,"yes_neg","Warn water events in the Columbia River have reduced salmon runs.","slight_neg","med","idk","high","idk","high","idk","high","idk","high","strong_neg","high","idk","high","idk","high","idk","high","idk","high","NA","NA","yes","Ocean warming and changes have affected the food supply for salmon, as various copepods are reduced in fat content, or replaced by other creatures not as nutritionally valuable to salmon.","yes","Chum salmon runs are a fraction of the size they once were in the Columbia River, which is now the southern end of their range. They once were well known along part of the Oregon coast, but are seriously depleted in that part of their range.","yes","the change has nothing to do with climate, but everything to do with re-allocating the resource to recreational fisheries who now have priority. Our fishing time is reduced, and we are now fishing on the end of runs, if at all.","I think that salmon and other migratory species are most likely to be affected, given the multiple habitats they utilize. Upper reaches of rivers where salmon spawn are likely to be warmer; migratory patterns nearshore are likely to be affected by warmer water and changed food supplies.","None","very","very","somewhat","very","very","very","very","very","frequently","frequently","occasionally","occasionally","occasionally","frequently","frequently","frequently","very","somewhat","none","somewhat","very","none","very","frequently","occasionally","occasionally","occasionally","frequently","occasionally","frequently","very","very","very","very","frequently","frequently","frequently","frequently","very","somewhat","none","somewhat","frequently","occasionally","occasionally","frequently","strongly_agree","strongly_agree","strongly_agree","somewhat_agree","somewhat_agree","somewhat_disagree","strongly_agree","strongly_agree","somewhat_disagree","somewhat_agree","strongly_agree","somewhat_disagree","somewhat_agree","strongly_agree","neutral","somewhat_agree","strongly_agree","strongly_agree","strongly_agree","somewhat_agree","somewhat_agree","somewhat_agree","somewhat_agree","somewhat_agree","strongly_disagree","strongly_agree","somewhat_agree","somewhat_agree","strongly_agree","strongly_agree","somewhat_agree","strongly_disagree","neutral","somewhat_disagree","neutral","somewhat_disagree","somewhat_disagree","somewhat_agree","strongly_disagree","somewhat_disagree","somewhat_disagree","strongly_disagree","somewhat_disagree","somewhat_disagree","strongly_disagree","strongly_disagree","strongly_disagree","somewhat_agree","somewhat_agree","strongly_agree","Improved modeling of salmon runs would be helpful. Would also urge that agencies take advantage of fishermen's knowledge and expertise regarding in-seasons management.","until agencies get a handle on recreational participation, handling mortality, and numbers of fish caught, particularly in salmon, there is little to no future for salmon runs or commercial salmon fishing. This is an area where agencies have turned a blind eye, but the mortalities are enormous and largely unaccounted for.","Kent Martin","i7846martin@gmail.com",1,1358.806,4,NA,10,NA,5,6,"01/07/2020 14:12",NA,NA,NA,0,"Mozilla/5.0 (Windows NT 10.0; Win64; x64) AppleWebKit/537.36 (KHTML, like Gecko) Chrome/79.0.3945.88 Safari/537.36","..","/survey/selfserve/5d8/191103?sampid=109407&pin=FOGW&mail=1","ykq68nt677n7f708",1,109407
"33",661,"IOCN","byx3fwqv8862ytnk","01/08/2020 14:27","qualified",3,0,0,0,0,0,1,0,0,0,0,0,NA,0,0,0,0,0,1,0,0,0,0,0,NA,0,0,1,0,0,0,0,"Cathlamet",98612,"25+","Cathlamet wa",98612,"25+",1,1,0,0,NA,"1-3","26-35",0,0,0,0,0,1,0,0,NA,"yes","Bristol Bay Ak","none","40-50","male",NA,"no","no","8+","increase","no_change","decrease",NA,NA,"yes_neg","In the Columbia River gillnet/tangle net fisheries the water temp changes has increased. This affects the wild salmon with the warmer water with higher mortalities,so in the tangle net fishery you have less soak times for your gear in the water.","idk","high","idk","high","idk","high","idk","high","idk","high","strong_neg","med","idk","high","idk","high","idk","high","idk","high","NA","NA","yes","Columbia river salmon are effected by northern orca whales feeding on them,also the seal and sea lion populations have a great effect on those salmon along the coast plus in the Columbia river itself with up to 40% of the spring salmon at or below the bonneville dam being taken by these predators. The double breasted cormorants and other birds do a lot of damage to out going smolt which impacts these salmon.","yes","In the Columbia River the commercial gillnet fleet has had their quota given to the sports fleet from the direction of the governors and F&W councils,also the largest impact is from the endangered species act. 2013 we had one of the largest returns of fall chinook. These fisheries depend on hatchery production and that has decreased over the years.","no",NA,"Salmon,but I’m not involved in any others here in Wa besides Columbia River.","Tuna would be my guess but I think most species will be negatively affected.","somewhat","somewhat","somewhat","somewhat","very","somewhat","very","very","occasionally","occasionally","never","occasionally","occasionally","occasionally","frequently","occasionally","very","somewhat","somewhat","very","somewhat","somewhat","very","frequently","occasionally","occasionally","frequently","frequently","occasionally","frequently","somewhat","very","very","somewhat","occasionally","frequently","frequently","occasionally","somewhat","somewhat","somewhat","very","occasionally","occasionally","frequently","occasionally","somewhat_agree","somewhat_agree","somewhat_agree","strongly_disagree","somewhat_agree","neutral","somewhat_disagree","strongly_agree","somewhat_agree","strongly_agree","somewhat_agree","strongly_disagree","neutral","somewhat_agree","neutral","strongly_agree","somewhat_agree","somewhat_agree","strongly_agree","somewhat_agree","neutral","neutral","somewhat_agree","neutral","somewhat_disagree","strongly_agree","neutral","somewhat_agree","strongly_agree","somewhat_agree","somewhat_agree","somewhat_disagree","somewhat_agree","strongly_disagree","somewhat_disagree","strongly_disagree","somewhat_disagree","somewhat_agree","strongly_disagree","somewhat_disagree","somewhat_disagree","somewhat_disagree","neutral","somewhat_agree","somewhat_agree","somewhat_agree","strongly_disagree","somewhat_agree","strongly_disagree","strongly_agree","In the Columbia River they use dam counts at bonneville which is 140 miles upriver,if they could do that closer to the river mouth it would be better.","In Oregon and Washington they have the F&W council that’s appointed by the governors which is biased,we should all have equal opportunity to harvest fish. They enacted the Columbia river reform which has impacted all the lower Columbia river communities and commercial fisherman. We need this gillnet fishery,with the Columbia river reform the states started experimental fisheries that have divided our community,and the states have not followed through on their promises that have impacted these fisherman and communities.","Mike Crouse","Kanoiter@hotmail.com",1,2276.568,12,NA,11,NA,3,1,"01/08/2020 13:46",NA,NA,NA,0,"Mozilla/5.0 (iPad; CPU OS 12_4 like Mac OS X) AppleWebKit/605.1.15 (KHTML, like Gecko) GSA/88.1.284108841 Mobile/15E148 Safari/605.1","ti","/survey/selfserve/5d8/191103?sampid=100033&pin=IOCN&mail=1","cp4wss2wb0cbs3xb",1,100033
"34",694,"PQTE","01vtc9yv1xea80ms","01/08/2020 17:39","qualified",3,0,0,0,0,0,1,0,0,0,0,0,NA,0,0,0,0,0,1,0,0,0,0,0,NA,1,0,0,0,0,0,0,"Everett",98201,"5-15","Lynnwood",98087,"25+",1,1,0,0,NA,"1-3","26-35",0,0,0,0,0,1,0,0,NA,"no",NA,"50+","50-60","male",NA,"no","no","1-2","increase","increase","decrease",NA,NA,"yes_neg","Wild swings in the amount of fish available,  More storms, changing fishing patterns from the past","idk","high","slight_neg","med","idk","high","idk","high","idk","high","strong_neg","high","idk","high","idk","high","idk","high","idk","high","NA","NA","yes","Legislative issue about killer whales","yes","Less consistency in runs sizes, fish come at different times and in different ways than in the past","no",NA,"Salmon","There seems to be much more jellyfish than in the past","very","very","very","somewhat","very","very","very","very","frequently","occasionally","frequently","occasionally","frequently","frequently","occasionally","occasionally","very","very","somewhat","very","somewhat","none","very","frequently","occasionally","frequently","frequently","occasionally","never","occasionally","somewhat","none","none","somewhat","occasionally","never","never","occasionally","none","none","very","somewhat","occasionally","never","frequently","occasionally","strongly_agree","strongly_agree","strongly_agree","somewhat_agree","strongly_agree","strongly_disagree","somewhat_agree","somewhat_agree","somewhat_agree","somewhat_agree","strongly_agree","strongly_disagree","neutral","somewhat_agree","neutral","strongly_agree","neutral","somewhat_agree","strongly_agree","somewhat_agree","neutral","somewhat_agree","somewhat_agree","strongly_agree","somewhat_disagree","somewhat_agree","strongly_disagree","somewhat_agree","somewhat_agree","neutral","strongly_disagree","strongly_disagree","somewhat_disagree","somewhat_agree","somewhat_agree","somewhat_disagree","somewhat_disagree","strongly_agree","strongly_disagree","somewhat_agree","somewhat_agree","somewhat_disagree","neutral","somewhat_disagree","neutral","somewhat_disagree","neutral","neutral","somewhat_disagree","somewhat_agree","More test fishing.  Having 1 set of rules for all users (native & non-natives)","The fishery could be managed better if 1 entity took the lead.  With the state and 26 tribes butting heads and following different rules it leads to possible overfishing, over taking of depleted stocks, etc.  None of this will change because of the Boldt decision, but if the fisheries is to be brought back this way of management needs to end.","Nick Barcott","nbarcott@msn.com",1,1645.734,4,NA,2,NA,5,6,"01/08/2020 17:11",NA,NA,NA,0,"Mozilla/5.0 (Windows NT 10.0; Win64; x64) AppleWebKit/537.36 (KHTML, like Gecko) Chrome/70.0.3538.102 Safari/537.36 Edge/18.18362","..","/survey/selfserve/5d8/191103?sampid=111814&pin=PQTE&mail=1","3cys8qgnrgn12z07",1,111814
"35",727,"QSXU","paunkjfc2jmykk3z","01/10/2020 16:12","qualified",3,0,0,0,0,1,1,0,0,0,0,0,NA,0,0,0,0,1,0,0,0,0,0,0,NA,0,1,1,1,0,0,0,"Coos Bay",97420,"25+","Coquille",97423,"25+",1,1,0,0,NA,"1-3","46-55",0,0,0,0,0,0,1,0,NA,"no",NA,"U10","60-70","male",NA,"no","no","1-2","increase","increase","decrease","increase","Weird dislocated species","yes_neg","The albacore act weird. They are not where they historically hang out. The fish are skinnier than normal. Water temperatures are sometimes so high our freezers have a difficult time maintaining temperature. The prevailing wind is historically from the NW. For the last 4-5 years it has been directly out of the north which affects up-welling negatively","idk","high","strong_neg","high","idk","high","idk","high","strong_neg","high","strong_neg","med","idk","high","idk","high","idk","high","idk","high","NA","NA","yes","Anchovies are a primary prey for Albacore. I used to see 4-6  anchovies puked out of the albacore most of the season. I haven't seen that in over 5 years. Nothing but pinheads showing.","yes","The macro migration patterns are not much changed but the micro patterns  are dramatically changed. I keep waiting for a new normal to develop but each year is dramatically different from all previous years, in my experience","yes","For the last several year the fish showed on the coast earlier than historically. Then last year they showed significantly later than historical","If ocean aciidification (OA) continues on trend every fishery will be negatively affected since krill will  be most affected. It's hard to place a hierarchy on specie by specie affect but it would seem to me the least migratory species would be the most affected since they would be less likely to change locations to escape the wort of conditions","I can't think of any","very","very","very","somewhat","very","very","very","very","frequently","frequently","frequently","frequently","frequently","frequently","frequently","occasionally","somewhat","somewhat","none","somewhat","very","very","somewhat","frequently","occasionally","occasionally","occasionally","frequently","frequently","occasionally","somewhat","somewhat","somewhat","very","occasionally","occasionally","occasionally","frequently","somewhat","somewhat","somewhat","somewhat","frequently","occasionally","occasionally","occasionally","strongly_agree","strongly_agree","strongly_agree","somewhat_agree","strongly_agree","strongly_disagree","neutral","somewhat_agree","somewhat_agree","somewhat_agree","somewhat_disagree","strongly_agree","strongly_disagree","strongly_disagree","somewhat_agree","somewhat_agree","somewhat_agree","neutral","strongly_agree","somewhat_agree","neutral","somewhat_disagree","strongly_agree","I have not observed any changes","neutral","somewhat_agree","somewhat_agree","somewhat_agree","strongly_agree","strongly_agree","strongly_agree","somewhat_agree","somewhat_agree","strongly_agree","somewhat_agree","somewhat_disagree","somewhat_agree","strongly_agree","somewhat_agree","somewhat_disagree","somewhat_agree","strongly_disagree","strongly_disagree","strongly_disagree","strongly_agree","strongly_disagree","somewhat_disagree","somewhat_agree","somewhat_disagree","somewhat_agree","MORE SCIENCE!!!  This is what we have been pushing for my entire life. We remain mostly unheard.","Fishermen should be incorporated into the scientific community on a PAID basis. Fishing boats should be equipped with data collecting devices that is uploaded in real time. Fishermen should be paid for the service.  The fishing community is full of climate change deniers so much of the participation in this survey might be wise asses hoping to  trigger  non-trump supporter sciencey types. Trump is willing to let the world burn to keep himself in power. We are all fucked. This affects my mental health more than anything else. Fuck trump!","Rick Goche","rick@sacredseatuna.com",1,3099.998,4,NA,10,NA,5,6,"01/10/2020 15:18",NA,NA,NA,0,"Mozilla/5.0 (Windows NT 10.0; Win64; x64) AppleWebKit/537.36 (KHTML, like Gecko) Chrome/77.0.3865.120 Safari/537.36 AVG/77.2.2157.122","..","/survey/selfserve/5d8/191103?sampid=113748&pin=QSXU&mail=1","qgnhdh8wqvyxuf1h",1,113748
"36",760,"HXFR","8e7zr75kg2rfj8e8","01/11/2020 15:27","qualified",3,0,0,0,0,0,1,0,0,0,0,0,NA,0,0,0,0,0,1,0,0,0,0,0,NA,1,0,0,0,0,0,0,"Lummi Island",98262,"25+","Lummi Island",98262,"25+",1,0,0,0,NA,"4-7","36-45",0,0,0,0,0,0,0,1,"Reefnet","no",NA,"25-50","70+","male",NA,"no","no","1-2","increase","increase","decrease","increase","bottomfish dieoff","yes_pos","Decreased size of Salmon to the point where some runs are endangered and closed to harvest","strong_pos","high","slight_neg","med","strong_neg","high","idk","low","idk","high","strong_neg","high","idk","high","strong_neg","high","slight_neg","med","strong_pos","high","NA","NA","yes","decrease in species that salmon feed on in the food chain","yes","A majority of Fraser Salmon are diverting from their  historical route to the river ( Straight of Juan de Fuca)  to Johnstone strait.","yes","30 years ago:  five days of harvest of sockeye per week begining the last week of June and continuing into August;  fall fishing October 1 through December.  . Today: average of 4 days in August harvest on sockeye, Two weeks fall fishing in October.","Salmon","Apparently squid and sea urchin, though the sea urchin species that has flourished is not a harvest species","very","very","very","very","very","very","very","very","frequently","frequently","frequently","frequently","frequently","frequently","occasionally","frequently","very","very","very","somewhat","somewhat","none","very","frequently","occasionally","frequently","frequently","frequently","never","frequently","somewhat","somewhat","very","very","occasionally","occasionally","frequently","frequently","somewhat","somewhat","very","none","occasionally","occasionally","frequently","never","strongly_agree","strongly_agree","strongly_agree","neutral","strongly_agree","strongly_disagree","strongly_agree","strongly_disagree","strongly_agree","somewhat_disagree","strongly_agree","strongly_agree","strongly_agree","strongly_agree","strongly_agree","somewhat_agree","neutral","somewhat_agree","somewhat_agree","strongly_agree","somewhat_agree","somewhat_agree","neutral","somewhat_agree","strongly_disagree","strongly_agree","somewhat_agree","somewhat_agree","strongly_agree","strongly_agree","neutral","somewhat_agree","strongly_agree","strongly_agree","somewhat_agree","somewhat_agree","somewhat_agree","somewhat_agree","somewhat_disagree","strongly_disagree","somewhat_disagree","strongly_disagree","neutral","neutral","neutral","strongly_disagree","strongly_disagree","strongly_disagree","strongly_disagree","strongly_disagree","More data collection from those who work on the water","gentrification of our fishing community has made a caricature  of our way of life.",NA,NA,1,2310.929,13,NA,11,NA,5,6,"01/11/2020 14:46",NA,NA,NA,0,"Mozilla/5.0 (Macintosh; Intel Mac OS X 10_10_5) AppleWebKit/603.3.8 (KHTML, like Gecko) Version/10.1.2 Safari/603.3.8","..","/survey/selfserve/5d8/191103?sampid=104335&pin=HXFR&mail=1","fbt9b70c0ur53rbt",1,104335
"37",793,"HMMO","22s88v1zk6brdypj","01/13/2020 14:34","qualified",3,0,0,0,0,1,1,0,0,0,0,0,NA,0,0,0,0,1,0,0,0,0,0,0,NA,0,0,0,1,0,0,0,"Winchester Bay",97467,"15-25","North Bend",97459,"15-25",1,1,1,0,NA,"1-3","56-65",0,0,0,0,0,0,1,0,NA,"no",NA,"none","50-60","female",NA,"no","yes","1-2","increase","increase","decrease",NA,NA,"yes_neg","Tuna were 1 month late in 2019, erratic behavior regarding size /location of schools, above average sst particularly in 2016","idk","med","strong_neg","high","idk","low","idk","high","slight_neg","high","strong_neg","high","idk","low","idk","med","idk","high","idk","high","NA","NA","yes","Less availability of bait","yes","Further north and erratic behavior regarding coastal proximity.","yes","Tuna were a month late last year.","Changes are across the board,  including rivers and estuaries","Demoic acid,  dead zones and red tides","very","somewhat","very","somewhat","very","very","very","very","frequently","occasionally","frequently","occasionally","frequently","frequently","frequently","frequently","somewhat","none","none","very","somewhat","somewhat","very","occasionally","never","occasionally","frequently","occasionally","occasionally","frequently","very","none","none","somewhat","frequently","never","never","occasionally","very","none","none","none","frequently","never","never","never","strongly_agree","strongly_agree","strongly_agree","neutral","somewhat_agree","strongly_disagree","strongly_disagree","somewhat_agree","somewhat_agree","strongly_disagree","strongly_agree","strongly_disagree","strongly_disagree","neutral","strongly_disagree","strongly_agree","strongly_disagree","strongly_disagree","strongly_agree","strongly_agree","strongly_disagree","strongly_disagree","strongly_agree","strongly_disagree","strongly_disagree","strongly_agree","strongly_agree","somewhat_agree","strongly_agree","strongly_agree","strongly_disagree","somewhat_disagree","somewhat_agree","somewhat_agree","somewhat_agree","strongly_disagree","strongly_agree","somewhat_agree","neutral","strongly_disagree","strongly_disagree","somewhat_disagree","strongly_disagree","strongly_agree","neutral","strongly_agree","strongly_agree","strongly_disagree","strongly_disagree","strongly_agree","In-season adjustment provided excellent communication exists","Profit margin has shrunk with the rise of more and more regulation, we must be cautious not to duplicate existing regulations as operations are already quite costly. Duplication has been attempted in some cases.","Petra Hawk","seabobo@frontier.com",1,1300.196,14,NA,10,NA,1,2,"01/13/2020 14:12",NA,NA,NA,0,"Mozilla/5.0 (Linux; Android 9; SAMSUNG SM-G950U) AppleWebKit/537.36 (KHTML, like Gecko) SamsungBrowser/10.2 Chrome/71.0.3578.99 Mobile Safari/537.36","sa","/survey/selfserve/5d8/191103?sampid=113610&pin=HMMO&mail=1","8zz6ghc84gj8ks1k",1,113610
"38",893,"EULG","rcp5qt19a6achqnh","01/18/2020 13:17","qualified",3,0,0,0,0,0,1,0,0,0,0,0,NA,0,0,0,0,0,1,0,0,0,0,0,NA,1,0,0,0,0,0,0,"Lummi Island",98262,"25+","Lummi Island ,Wa",98262,"15-25",1,1,0,0,NA,"4-7","26-35",0,0,0,0,0,0,0,1,"Reef Net","no",NA,"50+","60-70","male",NA,"no","no","1-2","increase","no_change","decrease",NA,NA,"yes_neg","Poor Ocean survival of Fraser River has resulted in two of the smallest runs in the past hundred years and continues to impact returns of the river","idk","med","slight_neg","med","strong_neg","high","idk","med","idk","med","strong_neg","high","idk","med","strong_pos","high","idk","med","idk","med","NA","NA","yes","Toxic alge blooms seem to be more common and affect outmigrating salmon fry","yes","lower ocean survival rates","yes","return timing has condensed into a shorter period","shellfish-oysters  salmon","don't know","very","very","somewhat","very","very","somewhat","very","very","frequently","frequently","occasionally","frequently","frequently","occasionally","frequently","frequently","very","somewhat","somewhat","very","somewhat","none","none","frequently","occasionally","occasionally","occasionally","occasionally","never","occasionally","somewhat","somewhat","somewhat","somewhat","frequently","occasionally","occasionally","occasionally","somewhat","none","very","somewhat","frequently","occasionally","frequently","occasionally","strongly_agree","strongly_agree","strongly_agree","strongly_disagree","somewhat_agree","strongly_disagree","strongly_disagree","neutral","neutral","neutral","somewhat_agree","strongly_disagree","neutral","strongly_agree","neutral","neutral","neutral","neutral","somewhat_agree","somewhat_agree","neutral","neutral","somewhat_agree","neutral","somewhat_agree","strongly_agree","strongly_agree","strongly_agree","strongly_agree","strongly_agree","somewhat_disagree","neutral","strongly_agree","strongly_agree","strongly_agree","strongly_agree","strongly_agree","strongly_agree","strongly_agree","strongly_agree","strongly_agree","somewhat_disagree","strongly_disagree","strongly_disagree","strongly_disagree","somewhat_disagree","strongly_agree","somewhat_agree","strongly_agree","strongly_disagree","Fraser Panel management does a good job","no","Steve Thatcher","scthatch@yahoo.com",1,1389.936,4,NA,2,NA,5,6,"01/18/2020 12:54",NA,NA,NA,0,"Mozilla/5.0 (Windows NT 10.0; Win64; x64) AppleWebKit/537.36 (KHTML, like Gecko) Chrome/64.0.3282.140 Safari/537.36 Edge/18.17763","..","/survey/selfserve/5d8/191103?sampid=101896&pin=EULG&mail=1","jhfeeduxnf89kt0a",1,101896
