"","record","pin","uuid","date","markers","status","CPS","dungeness_crab","groundfish","hake","HMS","salmon","scallops","urchin","shrimp","squid","other","species","CPS_income","dungeness_crab_income","groundfish_income","hake_income","HMS_income","salmon_income","scallops_income","urchin_income","shrimp_income","squid_income","other_income","other_spp_income","pugetsound_SJF","wa_coast","cr","or_coast","norcal","cencal","socal","homeport","port_zip","yrs_fishing","hometown","home_zip","yrs_residence","captain","vessel_owner","crew","other_role","other_role_descrip","crew_num","vessel","longline","midwater_trwl","bottom_trwl","pots","purse_seine","gillnet","troll","other_gear","other_gear_descrip","other_fisheries","other_fisheries_descrip","income","age","gender","other_gender","tribe","smoke","alcohol","ocean_temp","severe_weather","target_spp","other_change","other_obs_change","ability","explanation","CPS_warming","CPS_warming_conf","dc_warming","dc_warming_conf","gf_warming","gf_warming_conf","hake_warming","hake_warming_conf","hms_warming","hms_warming_conf","salmon_warming","salmon_warming_conf","scallop_warming","scallop_warming_conf","urchin_warming","urchin_warming_conf","shrimp_warming","shrimp_warming_conf","squid_warming","squid_warming_conf","other_warming","other_warming_conf","change_other_spp","other_spp_impact","range_change","range_change_descrp","timing_change","timing_change_descrp","spp_neg","spp_pos","warming_concern","oa_concern","storm_concern","sea_level_concern","weather_concern","h20_quality_concern","algal_concern","habitat_concern","think_warming","think_oa","think_storm","think_sea_level","think_weather","think_h20_quality","think_algal","think_habitat","pop_size_concern","bycatch_concern","value_concern","costs_concern","sa_concern","distance_concern","reg_concern","think_pop_size","think_bycatch","think_value","think_costs","think_sa","think_distance","think_reg","graying_fleet_concern","fish_comm_concern","resid_concern","infrastructure_concern","think_graying_fleet","think_fish_comm","think_resid","think_infrastructure","phsy_health_concern","mental_health_concern","safe_at_sea_concern","family_concern","think_phsy_health","think_mental_health","think_safe_at_sea","think_family","believe","harm_me","harm_future","leave_fishing","risk","no_point","no_fish","recreational","other_fishery","internal","aquaculture","hatcheries","tourism","development","spatial","fish_neg_wellbeing","fish_neg_health","fish_neg_mental","fish_increase_stress","env_neg_welbeing","env_neg_health","env_neg_mental","env_increase_stress","env_neg_safety","enc_child","identity","comm_support","generation","connect_env","connect_comm","money","plan","job_sat","effective_mgmt","data","find_crew","voice","climate_in_mgmt","equitable","opp_outside","opp_crew","new_fishery","nat_resource_job","other_job","loan","distance","strong_comm","climate_refugees","adapt_mgmt","const_reg","flexible_mgmt","final_thoughts","name","email","vlist","qtime","vos","vosr15oe","vbrowser","vbrowserr15oe","vmobiledevice","vmobileos","start_date","vdropout","source","decLang","list","userAgent","dcua","url","session","mail","sampid"
"1",1,"VTVC","t9325hhz6hhrafn0","12/28/2019 16:02","qualified",3,0,0,0,0,0,1,0,0,0,0,0,NA,0,0,0,0,0,1,0,0,0,0,0,NA,1,0,0,0,0,0,0,"Seattle",98119,"25+","Tacoma",98335,"15-25",1,1,0,0,NA,"1-3","26-35",0,0,0,0,0,1,0,0,NA,"no",NA,"50+","60-70","male",NA,"no","no","1-2","increase","no_change","decrease",NA,NA,"no_obs_change",NA,"strong_neg","low","no_effect","high","slight_neg","high","slight_neg","high","slight_neg","high","slight_neg","high","slight_neg","high","strong_neg","high","no_effect","high","slight_pos","high","NA","NA","no",NA,"yes","The Fraser River Sockeye runs are all but gone.  The other species of salmon in Puget sound are being destroyed by state mismanagement.  Not using the best scientific information to correct the salmon runs.","no",NA,"I'm not sure if climate change is precipitated by human involvement, or wether it is just a natural weather change to our planet.","I'm not sure because some species may be positively  affected, but their food source maybe negatively  affected.","somewhat","somewhat","none","none","none","very","very","very","occasionally","occasionally","never","never","never","occasionally","never","occasionally","very","somewhat","none","somewhat","very","none","very","frequently","never","occasionally","occasionally","frequently","never","frequently","none","somewhat","somewhat","somewhat","never","occasionally","occasionally","occasionally","very","none","none","none","frequently","never","never","never","somewhat_agree","somewhat_agree","neutral","strongly_agree","strongly_agree","strongly_agree","strongly_agree","somewhat_agree","somewhat_agree","strongly_agree","strongly_agree","strongly_disagree","strongly_disagree","strongly_agree","neutral","somewhat_agree","neutral","somewhat_disagree","somewhat_agree","somewhat_agree","neutral","neutral","somewhat_agree","neutral","strongly_disagree","strongly_disagree","strongly_disagree","strongly_disagree","strongly_agree","strongly_agree","strongly_disagree","strongly_disagree","strongly_disagree","strongly_disagree","neutral","strongly_disagree","strongly_disagree","neutral","strongly_disagree","strongly_disagree","strongly_disagree","strongly_disagree","strongly_disagree","strongly_disagree","strongly_disagree","strongly_disagree","strongly_disagree","neutral","strongly_agree","neutral","To understand that much of the habitats and water purity as been so badly contaminated that only water supplied by deep well and used in hatcheries will facilitate the return of many runs.  Coastal pollution by aquaculture businesses have ruined the Farser River.","The state of Washington must understand that only through hatcheries will salmon runs be returned  to normal levels.",NA,NA,1,1889.666,12,NA,11,NA,3,1,"12/28/2019 15:30",NA,NA,NA,0,"Mozilla/5.0 (iPad; CPU OS 9_3_5 like Mac OS X) AppleWebKit/601.1.46 (KHTML, like Gecko) Version/9.0 Mobile/13G36 Safari/601.1","ti","/survey/selfserve/5d8/191103?sampid=109826&pin=VTVC&mail=1","rp6ge3ws9yzew3ft",1,109826
"2",2,"XZVJ","0cx7x7xms98q498j","12/28/2019 16:52","qualified",3,1,0,0,0,0,1,0,0,0,1,0,NA,0,0,0,0,0,1,0,0,0,1,0,NA,1,0,0,0,0,1,1,"Bellingham",98225,"25+","Bellingham",98225,"25+",1,1,0,0,NA,"4-7","66+",0,0,0,0,1,0,0,0,NA,"yes","Herring, salmon, Alaska","none","70+","male",NA,"no","no","1-2","no_change","no_change","decrease",NA,NA,"yes_neg","Pacific Council shut down Sardine fishery  Alaska Board of Fisheries has not.acted in a timely manner in the herring fisheries.  Roe herring markets have disappeared and the quotas are the highest ever.  Sitka herring have no roe value but we have been trying for over 20 years to allow us with Sitka seine herring permits to have an alternative harvest method of open pound spawn on kelp.  Right now the Alaska Entry Commission has the Board of Fish unable to act. Because they overlapped the areas when they instigated limited entry in Hoona Sound.  Bureaucratic bad move.  Years wasted.","no_effect","high","no_effect","high","no_effect","high","no_effect","high","no_effect","high","no_effect","high","no_effect","high","no_effect","high","no_effect","high","no_effect","high","NA","NA","yes","Your questions cannot be answered so simply.  The strength of the California Current affects the coast upwelling, thus the food source.  Bristol Bay salmon is strong, SE Alaska pink salmon are weak.  Anchovy are strong in the Columbia River.  Canada has poor salmon runs but herring are stronger.  Environmental groups are challenging the pelagic fisheries both east coast and west coast.  The quota reduction in the menhaden fishery in Chesapeake Bay is not based on science.","yes","The range of pacific Sardine has expanded and retracted for the last 2000 years.  The presentations at the Tri-National Sardine meetings have shown through core samples the fish have expansion and retraction episodes.  We know water temperature affects lots of fisheries.  We have changes all the time.","no",NA,"The challenges of management, and the managers education are one of the problems today.","Give it some time.","somewhat","somewhat","none","none","none","somewhat","somewhat","very","frequently","frequently","occasionally","never","never","occasionally","occasionally","occasionally","somewhat","very","very","very","very","somewhat","very","frequently","frequently","frequently","occasionally","frequently","occasionally","frequently","very","somewhat","somewhat","very","occasionally","occasionally","occasionally","frequently","none","none","very","none","occasionally","occasionally","frequently","occasionally","neutral","neutral","somewhat_disagree","strongly_disagree","somewhat_disagree","somewhat_disagree","neutral","strongly_agree","strongly_agree","somewhat_agree","strongly_agree","neutral","somewhat_agree","neutral","neutral","neutral","neutral","somewhat_agree","somewhat_agree","neutral","neutral","neutral","neutral","neutral","somewhat_agree","somewhat_disagree","neutral","strongly_agree","strongly_agree","strongly_agree","somewhat_agree","somewhat_agree","somewhat_agree","strongly_disagree","somewhat_agree","strongly_disagree","somewhat_agree","somewhat_disagree","strongly_disagree","somewhat_agree","somewhat_agree","strongly_disagree","neutral","neutral","strongly_agree","strongly_agree","neutral","neutral","strongly_disagree","strongly_disagree","Federal Councils and State Boards are usually appointed with not much knowledge of the fisheries they regulate.  We are constantly trying to educate individuals about the fisheries so they can make good choices.    An example.  Togiak herring processors lost money last year.  The fishery quota is almost 40,000 tones in 2020.  Almost all processors are not going to buy herring in Togiak in 2020.  The Alaska Board of Fisheries should move 10,000 tons to the Dutch Harbor herring fishery.  Much more value as food and bait herring then roe herring.  But the subject is on a three year cycle  with the Board so nothing will be done.  Not good management.","The management of fisheries have evolved over time into monster situations.that are almost unmanageable.",NA,NA,1,4437.159,12,NA,11,NA,3,1,"12/28/2019 15:38",NA,NA,NA,0,"Mozilla/5.0 (iPad; CPU OS 12_3_1 like Mac OS X) AppleWebKit/605.1.15 (KHTML, like Gecko) Version/12.1.1 Mobile/15E148 Safari/604.1","ti","/survey/selfserve/5d8/191103?sampid=104562&pin=XZVJ&mail=1","z5jaz9hytp913c3w",1,104562
"3",3,"DVHQ","vbf3124atz4tueve","12/28/2019 17:50","qualified",3,0,1,0,0,0,0,0,0,0,0,0,NA,0,1,0,0,0,0,0,0,0,0,0,NA,0,1,0,0,0,0,0,"Bellingham",98225,"25+","My vernon",98274,"5-15",1,1,0,0,NA,"1-3","36-45",1,0,0,1,0,0,0,0,NA,"yes","Alaska longline blackcod","none","50-60","male",NA,"no","no","1-2","no_change","no_change","no_change",NA,NA,"no",NA,"no_effect","high","no_effect","high","no_effect","high","idk","high","idk","high","no_effect","high","idk","high","idk","high","no_effect","high","idk","high","NA","NA","yes","Lonelines in Alaska ,sperm whales eating black cod     Coastal crab, to many humpback whales","yes","Seems to me they cycle up  and down  (their is more scientists trying to make sense of these but most take the easy road and suggest climate change)","yes","Mostly reorganizing fisheries","None","No","none","somewhat","none","none","none","somewhat","somewhat","somewhat","never","occasionally","never","never","never","occasionally","occasionally","occasionally","somewhat","somewhat","somewhat","somewhat","very","somewhat","very","occasionally","occasionally","frequently","frequently","occasionally","never","frequently","none","none","none","somewhat","never","never","never","occasionally","somewhat","none","somewhat","none","occasionally","never","occasionally","never","strongly_disagree","strongly_disagree","strongly_disagree","strongly_disagree","neutral","somewhat_agree","strongly_disagree","neutral","somewhat_agree","strongly_agree","neutral","neutral","neutral","neutral","somewhat_agree","neutral","I have not observed any changes","neutral","I have not observed any changes","somewhat_disagree","somewhat_disagree","somewhat_disagree","somewhat_disagree","somewhat_disagree","somewhat_agree","somewhat_agree","somewhat_agree","strongly_agree","somewhat_agree","somewhat_agree","strongly_agree","strongly_agree","strongly_agree","somewhat_disagree","somewhat_agree","somewhat_agree","somewhat_agree","strongly_disagree","somewhat_disagree","neutral","somewhat_agree","strongly_agree","somewhat_agree","somewhat_agree","somewhat_agree","somewhat_agree","somewhat_agree","somewhat_disagree","somewhat_disagree","neutral","Get tribal fisheries to be equally managed by one department and don’t fix it if it isn’t broken","Get an accurate count on whales and start taking species off endangered list if noted,its time to acknowledge what good biology can do and it is doing!",NA,NA,1,3251.933,13,NA,11,NA,5,6,"12/28/2019 16:56",NA,NA,NA,0,"Mozilla/5.0 (Macintosh; Intel Mac OS X 10_15) AppleWebKit/605.1.15 (KHTML, like Gecko) Version/13.0.4 Safari/605.1.15","..","/survey/selfserve/5d8/191103?sampid=110461&pin=DVHQ&mail=1","6csm6afc7kjy574x",1,110461
"4",4,"JEGY","zkxsqevf1pup6tjm","12/28/2019 20:09","qualified",3,0,0,0,0,0,1,0,1,0,0,1,"sea cucumber",0,0,1,0,0,1,0,1,0,0,1,"sea cucumber",1,0,0,1,0,0,0,"Aberdeen",98520,"25+","aberdeen",98520,"0-5",1,1,1,0,NA,"1-3","U25",0,0,0,1,0,0,1,1,"diving","yes","Alaska shrimp","25-50","50-60","male",NA,"no","no","1-2","increase","no_change","no_change",NA,NA,"no_obs_change",NA,"no_effect","med","slight_neg","high","no_effect","high","no_effect","high","slight_pos","med","strong_neg","high","idk","med","slight_pos","high","no_effect","med","idk","med","slight_pos","high","no",NA,"no",NA,"yes","Government regulations have decreased fishing opportunities","salmon & crab most likely","kelp","somewhat","somewhat","none","none","none","somewhat","somewhat","none","occasionally","never","never","never","never","frequently","occasionally","occasionally","somewhat","none","none","very","very","somewhat","very","occasionally","occasionally","occasionally","frequently","frequently","frequently","frequently","none","none","none","somewhat","never","never","never","never","none","none","somewhat","very","occasionally","occasionally","frequently","frequently","strongly_agree","strongly_disagree","somewhat_disagree","strongly_disagree","strongly_agree","somewhat_disagree","strongly_disagree","strongly_agree","somewhat_agree","somewhat_disagree","strongly_agree","strongly_disagree","strongly_agree","strongly_agree","strongly_agree","somewhat_agree","somewhat_disagree","somewhat_agree","somewhat_agree","somewhat_disagree","somewhat_disagree","somewhat_agree","somewhat_agree","somewhat_disagree","strongly_agree","strongly_agree","strongly_agree","strongly_agree","strongly_agree","strongly_disagree","somewhat_agree","strongly_disagree","somewhat_agree","strongly_disagree","somewhat_disagree","somewhat_agree","strongly_disagree","strongly_disagree","strongly_disagree","strongly_disagree","strongly_disagree","strongly_disagree","somewhat_agree","somewhat_agree","strongly_disagree","strongly_agree","strongly_disagree","strongly_disagree","strongly_disagree","strongly_agree","decisions should be made by the lisence holders and those people should have more voice in the management of the fisheries. most fisheries are managed by biologists, and not fisherman, and biologists lack practical fishing experience.","over regulation of the fisheries are having negative financial impacts on all participants","christopher sondie","mjwilliamson9@gmail.com",1,1741.334,12,NA,11,NA,1,1,"12/28/2019 19:40",NA,NA,NA,0,"Mozilla/5.0 (iPhone; CPU iPhone OS 12_1_4 like Mac OS X) AppleWebKit/605.1.15 (KHTML, like Gecko) Version/12.0 Mobile/15E148 Safari/604.1","si","/survey/selfserve/5d8/191103?sampid=102100&pin=JEGY&mail=1","r2tseyd9bx41cyvb",1,102100
"5",34,"LIPP","ybf7tkkxdqna0syv","12/29/2019 09:42","qualified",3,0,0,0,0,0,0,0,0,0,0,1,"geoduck, sea cucumber",0,0,0,0,0,0,0,0,0,0,1,"geoduck, sea cucumber",1,0,0,0,0,0,0,"Gig Harbor, Ketchikan",98332,"5-15","Tacoma",98407,"5-15",1,0,0,0,NA,"1-3","36-45",0,0,0,0,0,0,0,1,"Dive","yes","SE AK dive fisheries","none","30-40","male",NA,"no","yes","1-2","no_change","decrease","decrease",NA,NA,"no_obs_change",NA,"idk","high","idk","high","idk","high","idk","high","idk","high","idk","high","idk","high","idk","high","idk","high","idk","high","no_effect","med","yes","SE Ak shellfish is being decimated by otter predation. Massive areas, entire sounds and bays have been swept clean of cucumbers, urchins and crab. Geoduck beds, which 3 years ago I was averaging 2000-2500lbs harvested in 6 hours, I struggled to harvest 1000 in the same time. Throughout Lower Cordova Bay, Paloma Pass and Sea Otter sound, once prime beds, otter holes are all that I often see.   Puget Sound geoduck fisheries are being depleted by humans. Mainly mismanagement through over reliance on an inaccurate and dated algorithm of harvest/recruitment, coupled with underestimated numbers on poaching and high grading. DNR has prioritized profit over sustainability. Many beds have been harvested multiple times per year, for up to 6 years in a row. Buyers push for quality, which leaves harvesters an option of high grading/poaching/off tract harvest or being fired for producing low quality product or underproducing. DNR is willfully not enforcing laws against such behavior for fear of WDFW taking more of a role in enforcement, and a larger share of revenue. Bad press is DNR’s worst fear.","yes","Ak- West Coast fisheries have gone from absurdly abundant to nearly nonexistent. It is my belief that within 5 years there will be no cucumber fishery and a poor geoduck fishery, bordering on closure.     Wa Geoduck- same story, but caused by poaching and bath math and enforcement on the management end of things. Geoducks will hold on for quite some time, but the resource is dwindling, and without a better rotation schedule of tracts and more time for bed recovery the problem will persist. As it stands, the auction of product leads to overpricing of resource and pressure to produce product that doesn’t exist in terms of quality or quantity from buyers","no",NA,"Hard for me to say, as the dive fisheries are very different from finfish and crab. I would imagine pelagic species would be hit the hardest. Crab perhaps. With geoduck we’ve seen a dramatic uptick in PSP levels esp in SE Ak. However there seems to be very little science as to the how, why and when of psp. Would be very interested to see research into that subject. Personal observations tell me that climate change may be playing a large role in the spike.","Seems rather unlikely. Warming waters and acidification seems fairly detrimental in the long run. I’ve talked to Biologists who’ve seen Great whites in SE Ak, and now there is occasionally a tuna fishery up there? That seems no bueno to me.","very","very","very","very","very","very","very","very","frequently","occasionally","frequently","occasionally","occasionally","frequently","frequently","frequently","very","very","somewhat","somewhat","very","somewhat","very","frequently","never","frequently","occasionally","frequently","occasionally","frequently","none","somewhat","somewhat","very","occasionally","frequently","occasionally","frequently","somewhat","somewhat","very","very","occasionally","never","frequently","frequently","strongly_agree","somewhat_agree","strongly_agree","neutral","somewhat_agree","somewhat_disagree","strongly_agree","strongly_disagree","strongly_disagree","strongly_agree","somewhat_agree","strongly_disagree","somewhat_disagree","strongly_agree","strongly_disagree","I have not observed any changes","I have not observed any changes","I have not observed any changes","somewhat_disagree","somewhat_agree","neutral","I have not observed any changes","somewhat_disagree","somewhat_disagree","somewhat_disagree","somewhat_agree","strongly_disagree","somewhat_agree","strongly_agree","somewhat_agree","strongly_agree","neutral","neutral","strongly_disagree","somewhat_disagree","somewhat_disagree","strongly_disagree","somewhat_agree","strongly_disagree","neutral","somewhat_agree","somewhat_disagree","somewhat_agree","somewhat_disagree","somewhat_agree","somewhat_agree","somewhat_disagree","somewhat_disagree","strongly_disagree","strongly_agree","In Ak, the MMPA has hamstrung any chance of saving the west coast shellfish fisheries from otter predation.     Wa- Take the states revenue out of the equation and manage the fishery for sustainability rather than state profit. The current model is entirely unsustainable.","In Ak the harvesters have enormous say in the management of the fishery via SARDFA, the divers association. Overall, management looks at what we would like to do, checks to see if the science backs up our views and goes with our advice generally.     Wa- I’ve never once Officially been asked how I think our fishery is being managed or conducted until this survey. What I see in the water diving 200 days/year is dramatically different than what state managers put in their surveys and reports. Perhaps a yearly survey, or a committee on fishery management comprised of all affected groups: community, harvesters and management","Michael Salter","saltdiver@me.com",1,2987.504,12,NA,11,NA,1,1,"12/29/2019 08:52",NA,NA,NA,0,"Mozilla/5.0 (iPhone; CPU iPhone OS 13_3 like Mac OS X) AppleWebKit/605.1.15 (KHTML, like Gecko) Version/13.0.4 Mobile/15E148 Safari/604.1","si","/survey/selfserve/5d8/191103?sampid=102759&pin=LIPP&mail=1","bvj0b5pay19kbumf",1,102759
"6",35,"HXJF","6q3bzyjrr217bn36","12/29/2019 09:33","qualified",3,0,0,0,0,0,1,0,0,0,0,0,NA,0,0,0,0,0,1,0,0,0,0,0,NA,0,1,1,0,0,0,0,"Aberdeen",98520,"25+","Aberdeen Wa",98520,"25+",1,1,1,0,NA,"1-3","26-35",0,0,0,0,0,1,0,0,NA,"no",NA,"none","60-70","male",NA,"no","no","1-2","no_change","no_change","decrease","increase","Politics instead of science management","no",NA,"idk","high","idk","high","idk","high","idk","high","idk","high","idk","high","idk","high","idk","high","idk","high","idk","high","NA","NA","yes","Predators are not being managed for population increases. Less salmon to harvest is the result.","yes","Less hatchery production. Less fish. Harvest priority has been given to recreational fishers. This even reduces the commercial share further due to political management over scientific management.","yes","Harvest time has shifted away from peak run timing due to politically motivated management.","Politicians and survey takers.","All species are directly affected by each other.","somewhat","somewhat","somewhat","somewhat","somewhat","somewhat","somewhat","somewhat","never","never","never","never","occasionally","occasionally","occasionally","frequently","very","very","somewhat","very","very","somewhat","very","frequently","occasionally","frequently","frequently","frequently","occasionally","frequently","somewhat","somewhat","none","somewhat","occasionally","occasionally","never","occasionally","very","somewhat","very","very","frequently","occasionally","frequently","frequently","somewhat_disagree","neutral","neutral","strongly_disagree","strongly_agree","somewhat_agree","somewhat_agree","strongly_agree","neutral","somewhat_disagree","somewhat_disagree","strongly_disagree","somewhat_disagree","somewhat_agree","somewhat_agree","somewhat_agree","somewhat_disagree","somewhat_disagree","neutral","neutral","neutral","neutral","neutral","somewhat_disagree","neutral","strongly_agree","somewhat_disagree","somewhat_agree","somewhat_agree","somewhat_agree","strongly_disagree","somewhat_disagree","somewhat_agree","strongly_disagree","strongly_agree","strongly_agree","strongly_disagree","strongly_disagree","strongly_disagree","strongly_agree","neutral","strongly_disagree","neutral","strongly_disagree","somewhat_agree","neutral","neutral","neutral","strongly_disagree","somewhat_agree","Take politics out of management.   The shortest life cycle of salmon is3 years. Nothing is quick in fish management.","More salmon need to be released by hatcheries to provide harvest by all user groups.",NA,NA,1,2128.463,12,NA,11,NA,3,1,"12/29/2019 08:56",NA,NA,NA,0,"Mozilla/5.0 (iPad; CPU OS 11_4_1 like Mac OS X) AppleWebKit/605.1.15 (KHTML, like Gecko) Version/11.0 Mobile/15E148 Safari/604.1","ti","/survey/selfserve/5d8/191103?sampid=100233&pin=HXJF&mail=1","4psxf5dt32kwsh4g",1,100233
